{
  "schema_version": "vfx_aesthetic_training_dataset.v1",
  "created_at": "2026-09-01T06:22:51.969346+00:00",
  "dataset_id": "aesthetic_training_r005",
  "source_count": 3,
  "record_count": 2698,
  "judge_candidate_count": 47,
  "judge_training_count": 47,
  "preference_candidate_count": 0,
  "preference_training_count": 0,
  "excluded_count": 2869,
  "exclusion_counts": {
    "non_training_record": 2651,
    "technical_exclusion": 218
  },
  "split_counts": {
    "judge": {
      "train": 47
    },
    "preference": {}
  },
  "split_group_counts": {
    "test": 100,
    "train": 788,
    "validation": 110
  },
  "training_gate": {
    "status": "blocked_insufficient_labels",
    "reason": "need at least 32 Judge examples and 20 preference pairs; found 47 and 0",
    "judge_ready": true,
    "preference_ready": false,
    "minimum_judge_examples": 32,
    "minimum_preference_pairs": 20
  },
  "files": {
    "records": "aesthetic_training_records.jsonl",
    "aesthetic_feedback": "aesthetic_feedback.jsonl",
    "preference_pairs": "preference_pairs.jsonl",
    "judge_training": "judge_training.jsonl",
    "preference_training": "preference_training.jsonl",
    "training_exclusions": "training_exclusions.jsonl",
    "split_assignments": "split_assignments.jsonl"
  },
  "policy": {
    "same_group_stays_in_one_split": true,
    "not_visible_is_not_aesthetic_training": true,
    "technical_exclusion_is_not_aesthetic_negative": true,
    "missing_features_are_not_silent": true,
    "course_prior_is_not_generation_success": true
  },
  "status": "pass"
}
